title,score,id,url,comms_num,created,body
"Question, where is my snakes tongue?",1153,yava3j,https://i.redd.it/m7kl13jyjev91.jpg,77,2022-10-22 18:42:21,
So I was abruptly frightened last night (not my snake),979,wilyzy,https://www.reddit.com/gallery/wilyzy,146,2022-08-07 18:06:45,
Dressed in full winter gear but bringing his tiny snake out in public for content. And he has half a million followers who find this hilarious.,759,zl3a7t,https://v.redd.it/jyukq2lr4r5a1,111,2022-12-13 18:41:41,
So my brother smashed my snake tank and I can’t get another tank rn does anyone know what I should do to make sure my snake is OK until I can get another tank?,717,rwg3sh,https://v.redd.it/tprkw1pebt981,84,2022-01-05 06:21:27,
Is this normal behavior for my snake? Also is anyone able to identify his morph please?,703,wmyakt,https://v.redd.it/f3p7l8hvrch91,39,2022-08-12 22:45:21,
Thinking About a Snake Rack (Photo for Tax lol),598,yg5j06,https://i.redd.it/027tudul6nw91.jpg,56,2022-10-29 00:47:45,
Snakes break into each others tanks to… cuddle?,597,yjssc6,https://i.redd.it/f03yrc6n6gx91.jpg,77,2022-11-02 02:19:35,
This week's PSA: don't let snakes roam in your vehicle,549,xim92n,https://i.redd.it/b6up4uc1bvo91.png,23,2022-09-19 19:34:19,
"I was told to stop breeding snakes with neurological issues, but unless I have somehow missed some recent major news, none of these morphs have any neurological issues. Pairing in comments.",511,whz3qf,https://i.redd.it/i2rf350by5g91.jpg,106,2022-08-06 21:44:42,
Belt snake doin a bleleleleh,483,vd0m8s,https://v.redd.it/b64pxgf7rt591,9,2022-06-15 18:02:12,
